{"$schema":"https://memory-os.example/schemas/memory-town/issue-code-extension.v1.schema.json","extensionId":"memory-town.issue-code-extension.round7-editable-landscape","extensionVersion":1,"baseRegistryId":"memory-town.issue-code-registry","baseRegistryVersion":1,"codes":[{"code":"TERRAIN_REGION_OVERLAP","layer":"spatial","defaultSeverity":"error","safeMessageKey":"memoryTown.issue.terrainRegionOverlap","retryable":false,"blocksApply":true,"mayIncludePrivateValue":false},{"code":"TERRAIN_EDIT_PROTECTED_BOUNDARY","layer":"spatial","defaultSeverity":"error","safeMessageKey":"memoryTown.issue.terrainEditProtectedBoundary","retryable":false,"blocksApply":true,"mayIncludePrivateValue":false},{"code":"COAST_TOPOLOGY_HOLE","layer":"spatial","defaultSeverity":"error","safeMessageKey":"memoryTown.issue.coastTopologyHole","retryable":false,"blocksApply":true,"mayIncludePrivateValue":false},{"code":"COAST_BUILDING_SUBMERGED","layer":"spatial","defaultSeverity":"error","safeMessageKey":"memoryTown.issue.coastBuildingSubmerged","retryable":false,"blocksApply":true,"mayIncludePrivateValue":false},{"code":"RIVER_SOURCE_OR_OUTLET_MISSING","layer":"semantic","defaultSeverity":"error","safeMessageKey":"memoryTown.issue.riverSourceOrOutletMissing","retryable":false,"blocksApply":true,"mayIncludePrivateValue":false},{"code":"RIVER_SEGMENT_DANGLING_REFERENCE","layer":"reference","defaultSeverity":"error","safeMessageKey":"memoryTown.issue.riverSegmentDanglingReference","retryable":false,"blocksApply":true,"mayIncludePrivateValue":false},{"code":"RIVER_CROSSES_BUILDING","layer":"spatial","defaultSeverity":"error","safeMessageKey":"memoryTown.issue.riverCrossesBuilding","retryable":false,"blocksApply":true,"mayIncludePrivateValue":false},{"code":"BRIDGE_ANCHOR_REQUIRED","layer":"spatial","defaultSeverity":"error","safeMessageKey":"memoryTown.issue.bridgeAnchorRequired","retryable":false,"blocksApply":true,"mayIncludePrivateValue":false},{"code":"ROAD_ACCESS_ROOT_DISCONNECTED","layer":"spatial","defaultSeverity":"error","safeMessageKey":"memoryTown.issue.roadAccessRootDisconnected","retryable":false,"blocksApply":true,"mayIncludePrivateValue":false},{"code":"DISTRICT_SOCKET_KIND_MISMATCH","layer":"semantic","defaultSeverity":"error","safeMessageKey":"memoryTown.issue.districtSocketKindMismatch","retryable":false,"blocksApply":true,"mayIncludePrivateValue":false},{"code":"DISTRICT_CONNECTION_PROFILE_MISMATCH","layer":"semantic","defaultSeverity":"error","safeMessageKey":"memoryTown.issue.districtConnectionProfileMismatch","retryable":false,"blocksApply":true,"mayIncludePrivateValue":false},{"code":"DISTRICT_SOCKET_ALREADY_OCCUPIED","layer":"state","defaultSeverity":"error","safeMessageKey":"memoryTown.issue.districtSocketAlreadyOccupied","retryable":false,"blocksApply":true,"mayIncludePrivateValue":false},{"code":"EXPANSION_RELOCATES_EXISTING_ORIGIN","layer":"migration","defaultSeverity":"error","safeMessageKey":"memoryTown.issue.expansionRelocatesExistingOrigin","retryable":false,"blocksApply":true,"mayIncludePrivateValue":false},{"code":"STALE_LANDSCAPE_REVISION","layer":"concurrency","defaultSeverity":"error","safeMessageKey":"memoryTown.issue.staleLandscapeRevision","retryable":true,"blocksApply":true,"mayIncludePrivateValue":false},{"code":"PINNED_OBJECT_DELETION_FORBIDDEN","layer":"state","defaultSeverity":"error","safeMessageKey":"memoryTown.issue.pinnedObjectDeletionForbidden","retryable":false,"blocksApply":true,"mayIncludePrivateValue":false},{"code":"DERIVED_DETAIL_MUTATED_USER_OBJECT","layer":"state","defaultSeverity":"error","safeMessageKey":"memoryTown.issue.derivedDetailMutatedUserObject","retryable":false,"blocksApply":true,"mayIncludePrivateValue":false}]}
